{
  "tool_name": "read_document",
  "input": {
    "document_id": "hr-manual-v7"
  },
  "schema": {
    "type": "object",
    "properties": {
      "document_id": {"type": "string", "minLength": 1}
    },
    "required": ["document_id"],
    "additionalProperties": false
  },
  "risk_level": "low",
  "approval_required": false,
  "caller_context": {
    "tenant_id": "tenant-a"
  }
}

